{"$schema":"./challenger-replacement-plan-v3-supersession-v1.schema.json","authority":{"broker_requests_allowed":false,"credentials_allowed":false,"production_activation":false,"real_orders_allowed":false,"replacement_start_authorized":false,"runtime_install_authorized":false},"machine_evidence":{"collected_at":"2026-08-22T22:33:23.703Z","evidence_hash":"289c8a43a7bd670336ee2fd615cd705eb7be458d2886a301e0b6783230c8fe4d","evidence_id":"challenger_replacement_v3_machine_evidence_71f5292e8bf410c3ace99b712885af183ab8158c09de49f6763b6107e528e489","file_sha256":"170dcf26bffdf36149997ed9ceb7d8553735e53daef4e189f90974468662fae1","git_history_evidence_hash":"643d4d0851a808c259f761ceabb99a3b527cf8a43b7a5590968c8fb46e2f39ec","path":"artifacts/challenger-replacement/challenger-replacement-v3-supersession-machine-evidence-v0.69.0.json"},"owner_attestation":{"attestation_hash":"99d99968eb5aa12bad064864d02aac4f37248a0fafb36d633c8c18315206fb21","attestation_id":"challenger_replacement_v3_owner_attestation_18626ea8f79c90f5924b50317635ce07c1c933879de42463f0e79095fb8e4388","file_sha256":"b1ec38575b2e4f2b93b9f4838aa04633f382b60aef65843e4812d9b5c799b9c7","path":"artifacts/challenger-replacement/challenger-replacement-v3-owner-attestation-v0.69.0.json","signed_at":"2026-08-22T22:34:13.087Z","signer_uid":501},"previous_plan":{"file_sha256":"5f1774fd912451d79c9efe13401e80f312fee3c707d9faa252933ef3e8810a8f","path":"artifacts/challenger-replacement/challenger-replacement-plan-v0.64.0.json","plan_hash":"c9a1e5f74c52fbf23be5a1d27fd23c25f3601ed58133178fc25480391ab65705","plan_id":"challenger_replacement_plan_65d85d60a534a917f45a1ffa5fc9d3f74d6d24995b900d31b8c73cd26f0bd97b","release_tag":"v0.64.0"},"prohibition":{"old_artifacts_mutable":false,"post_start_reset_allowed":false,"supersession_forbidden_after":"FIRST_V3_START_RECEIPT_OR_CANONICAL_PRODUCTION_OPPORTUNITY_EVENT"},"reason":"SUPERSEDED_PRE_START_RESEARCH_AND_OPERATIONAL_POLICY_CHANGE","record_hash":"6df9affb45e7d4d1cd8527fa5ac06ae9f62caef32f8ba8a9761b71d44ae178f0","record_id":"challenger_replacement_plan_v3_supersession_a59cc780b615313d48697014867ac2c8a0d1d6a77f990d5a9bc7da5983c9763c","schema_version":"1.0.0","semantic_diff_hash":"33cd3ab79deaf32ed1b5660855c2ff1641988f1bf1a3672593cf28e0f52b12fd","status":"PLAN_V3_SUPERSESSION_RECORDED_PRE_START","superseding_plan":{"file_sha256":"6fae2ae0df4b8402ddc1df1b5bca611e11df41eee8d42f591d5d7b5fb24a31c3","path":"artifacts/challenger-replacement/challenger-replacement-plan-v0.69.0.json","plan_hash":"f29474a1700b0c3cf313047e2d6e85182e68104d9584ec9df7b492aa7ab00486","plan_id":"challenger_replacement_plan_v3_e1b6a4187cb4bb4b371ea503f83284056d4f0c6c504feb7827971869a52f666f"},"v068_foundation":{"build_input_tree_hash":"0e6bde43eff304bc42cab90895da47296a9c6b8996b0d99a0d1ca4009a71083e","manifest_file_sha256":"d7c70074fef46f28d028cc330a8726755fe999bba5af90af90a24f285df37a79","manifest_hash":"f4ce2f0a67b04541b850f5841897927e2886a339fecb3f11356ad96b2d7370b5","manifest_version":"1.62.0","package_version":"0.68.0","peeled_commit":"1371997d61679609804d58753ae79147d60e1c01","release_tag":"v0.68.0"},"warnings":["MACHINE_OBSERVATION_IS_CURRENT_NOT_HISTORICAL_PROOF","OWNER_ATTESTATION_IS_ACCOUNTABLE_GOVERNANCE_CLAIM","NO_INSTALL_START_CREDENTIAL_ORDER_FUND_OR_CANARY_AUTHORITY"]}
